{
  "label": "Supabase",
  "description": "Supabase connector: pure-logic components for auth and data. Setup Client creates the client from your project URL + anon key (Noodl.Variables.supabase); Log In, Log Out, Sign Up, Send Magic Link, Send Password Reset, Resend Confirmation, Update/Fetch Current User Auth and Profile Data cover the auth flows, and an Example Request shows a from().select() query. No UI — wire the Do/Success/Failure signals into your own pages. Originally by @gmaison and @RicoTrevisan.",
  "type": "prefab",
  "tags": [
    "Data",
    "Auth",
    "Backend"
  ],
  "icon": "icon.png",
  "docsPath": "/library/prefabs/supabase/",
  "version": "2.0.0",
  "minEditorVersion": "0.1.0",
  "runtimeVersion": "2.7.0",
  "provenance": {
    "sourceUrl": "https://the-low-code-foundation.github.io/opennoodl-docs/library/prefabs/supabase/supabase-prefab-1.zip",
    "importedAt": "2026-07-25"
  }
}
