{
  "label": "Pagination",
  "description": "Full pagination control: page numbers with ellipsis overflow, prev/next buttons, an optional rows-per-page selector and an optional \"Showing X–Y of Z\" summary. Inputs: Total Items, Items Per Page, Current Page. Outputs: Current Page, Offset (plugs into Query Records' Skip), Items Per Page (plugs into Limit) and a Changed signal. Merges the former Pages And Rows prefab.",
  "type": "prefab",
  "tags": [
    "UI",
    "Data"
  ],
  "icon": "icon.png",
  "docsPath": "/library/prefabs/pagination/",
  "version": "2.0.0",
  "minEditorVersion": "0.1.0",
  "runtimeVersion": "2.7.0",
  "provenance": {
    "sourceUrl": "https://the-low-code-foundation.github.io/opennoodl-docs/library/prefabs/pagination/pagination-0-2.zip",
    "importedAt": "2026-07-25"
  }
}
