{
  "label": "Media Query",
  "description": "Contains a handy component to create responsive interfaces.",
  "type": "prefab",
  "tags": [
    "UI",
    "Utility"
  ],
  "icon": "icon.png",
  "docsPath": "/library/prefabs/media-query/",
  "version": "0.2.0",
  "minEditorVersion": "0.1.0",
  "runtimeVersion": "2.7.0",
  "provenance": {
    "sourceUrl": "https://the-low-code-foundation.github.io/opennoodl-docs/library/prefabs/media-query/media-query-0-2.zip",
    "importedAt": "2026-07-25"
  }
}
